{"algorithm":{"implementation":"nautilus-sampler (actual package) via samplingdemo.samplers.nautilus_adapter.run_seeds","name":"nautilus","settings":{"nautilus_version":"1.0.6","quick":false,"run":{"discard_exploration":true,"f_live":0.01,"n_eff":10000,"n_like_max":"inf","n_shell":1,"timeout":"inf","verbose":false},"sampler":{"blobs_dtype":null,"enlarge_per_dim":1.1,"filepath":null,"n_batch":100,"n_dim":2,"n_like_new_bound":5000,"n_live":500,"n_networks":[4,0],"n_points_min":52,"n_update":500,"neural_network_kwargs":{},"pass_dict":false,"periodic":null,"pool":null,"resume":false,"seed":[1,2,3,4,5],"split_threshold":100,"vectorized":true}},"version":"1.0.6"},"content_hash":"45e1a6468b42faff","counters":{"geometric_candidates":7387000,"gradient_calls":0,"likelihood_calls":298200,"neural_predictions":911941,"pilot_likelihood_calls":0,"training_operations":320,"value_and_gradient_calls":0},"diagnostics":{"e_a2_error_n_networks_0":{"note":"Mean, sample sd and standard error over 5 seeds (n_networks=0).","reference":null,"valid":true,"value":{"mean":-0.003518166501284825,"n":5,"sd":0.005054256425755353,"se":0.0022603321887408176}},"e_a2_error_n_networks_4":{"note":"Mean, sample sd and standard error over 5 seeds (n_networks=4).","reference":null,"valid":true,"value":{"mean":-0.0015684662721139552,"n":5,"sd":0.00638969862449489,"se":0.0028575600960214953}},"likelihood_calls_n_networks_0":{"note":"Mean, sample sd and standard error over 5 seeds (n_networks=0).","reference":null,"valid":true,"value":{"mean":41660.0,"n":5,"sd":658.027355054484,"se":294.27877939124323}},"likelihood_calls_n_networks_4":{"note":"Mean, sample sd and standard error over 5 seeds (n_networks=4).","reference":null,"valid":true,"value":{"mean":17980.0,"n":5,"sd":130.38404810405297,"se":58.309518948453}},"log_z_error_n_networks_0":{"note":"Mean, sample sd and standard error over 5 seeds (n_networks=0).","reference":null,"valid":true,"value":{"mean":0.0026699996526364346,"n":5,"sd":0.0049594673485154235,"se":0.002217941224694225}},"log_z_error_n_networks_4":{"note":"Mean, sample sd and standard error over 5 seeds (n_networks=4).","reference":null,"valid":true,"value":{"mean":0.0004625359499266679,"n":5,"sd":0.0061684143806640754,"se":0.0027585987737104275}},"p_positive_error_n_networks_0":{"note":"Mean, sample sd and standard error over 5 seeds (n_networks=0).","reference":null,"valid":true,"value":{"mean":-0.0011216389137637117,"n":5,"sd":0.006533349345217634,"se":0.002921802651332074}},"p_positive_error_n_networks_4":{"note":"Mean, sample sd and standard error over 5 seeds (n_networks=4).","reference":null,"valid":true,"value":{"mean":0.0027683284482682203,"n":5,"sd":0.002974296659391939,"se":0.0013301459031301826}}},"display":{"coordinates":["physical"],"rounding":{},"subsampling":"none"},"kind":"nautilus","label":"Nautilus 1.0.6 \u2014 two configurations (n_networks 4 vs 0) on a 2-D toy; not a general benchmark","mode":"actual","model":{"hash":"7afa6b107043040e","model_id":"B-curved","params":{"d_c":0.0,"d_s":1.0,"model_id":"B-curved","response":"quadratic","sigma_c":0.6,"sigma_s":0.12,"tau_a":2.0,"tau_b":1.0}},"payload":{"aggregate":{"n_networks_0":{"e_a2_error":{"mean":-0.003518166501284825,"n":5,"sd":0.005054256425755353,"se":0.0022603321887408176},"likelihood_calls":{"mean":41660.0,"n":5,"sd":658.027355054484,"se":294.27877939124323},"log_z_error":{"mean":0.0026699996526364346,"n":5,"sd":0.0049594673485154235,"se":0.002217941224694225},"p_positive_error":{"mean":-0.0011216389137637117,"n":5,"sd":0.006533349345217634,"se":0.002921802651332074}},"n_networks_4":{"e_a2_error":{"mean":-0.0015684662721139552,"n":5,"sd":0.00638969862449489,"se":0.0028575600960214953},"likelihood_calls":{"mean":17980.0,"n":5,"sd":130.38404810405297,"se":58.309518948453},"log_z_error":{"mean":0.0004625359499266679,"n":5,"sd":0.0061684143806640754,"se":0.0027585987737104275},"p_positive_error":{"mean":0.0027683284482682203,"n":5,"sd":0.002974296659391939,"se":0.0013301459031301826}}},"configurations":{"n_networks_0":{"cdf_a_sup":[0.005665786602907036,0.005520613935813046,0.008264102425431241,0.012551766582264812,0.008421680298506873],"cdf_b_sup":[0.006836079956930585,0.006819310926115318,0.010787279975956743,0.010683702258630579,0.01319335856911058],"e_a2":[0.8134709569030865,0.8117572654610756,0.8067776961493831,0.8035612590539354,0.8018102726672762],"e_a2_error":[0.002477300354850276,0.0007636089128394419,-0.00421596039885308,-0.007432397494300802,-0.009183383880959961],"geometric_candidates":[759000,724000,724000,718000,737000],"kish_ess":[10017.591454606367,10016.107164420686,10023.979694999425,10030.609726238028,10012.111211003392],"likelihood_calls":[42400,41500,41100,41000,42300],"log_z":[-2.6691421286852153,-2.658001477008759,-2.6593983054054977,-2.6673518461873473,-2.6610599101062187],"log_z_error":[-0.0034813955539712005,0.007659256122484859,0.006262427725746367,-0.001691113056103255,0.004600823025025402],"log_z_error_exploration_kept":[-0.0020376667015571392,-0.0017399554860833,0.006161001576864944,-0.0005492753113065518,-0.0031595126989456546],"n_bounds":[12,12,12,12,12],"n_eff":[10017.591454606367,10016.107164420679,10023.979694999427,10030.609726238017,10012.111211003405],"neural_predictions":[0,0,0,0,0],"p_positive":[0.5029365074845917,0.5007667141962765,0.5042756288571986,0.4878570308596497,0.49855592403346494],"p_positive_error":[0.0029365074845917327,0.0007667141962764967,0.004275628857198566,-0.01214296914035029,-0.0014440759665350633],"seed":[1,2,3,4,5],"training_operations":[0,0,0,0,0]},"n_networks_4":{"cdf_a_sup":[0.008429113239017627,0.008909037097214079,0.010447056979072555,0.009172607338961192,0.012622269346921122],"cdf_b_sup":[0.0070086527037606094,0.007401001780914129,0.005487240523189163,0.00744154446375811,0.013114170012792359],"e_a2":[0.8083353789888916,0.8083447288113444,0.8132887852674474,0.8170813778575983,0.8000756804553294],"e_a2_error":[-0.0026582775593445573,-0.0026489277368917374,0.0022951287192112257,0.006087721309362082,-0.01091797609290679],"geometric_candidates":[759000,741000,744000,737000,744000],"kish_ess":[10026.548761921975,10078.284103000762,10022.436954992383,10049.837283760584,10083.172861582096],"likelihood_calls":[17900,18200,17900,17900,18000],"log_z":[-2.6617910660340947,-2.6605944412006766,-2.675894121985357,-2.6646883580618974,-2.6630229986245615],"log_z_error":[0.0038696670971494207,0.0050662919305675125,-0.010233388854112846,0.0009723750693466648,0.0026377345066825875],"log_z_error_exploration_kept":[0.006769406696716107,0.0058508249039816995,-0.014346066345631403,0.00018649870959031034,0.0017450861638352855],"n_bounds":[11,11,11,11,11],"n_eff":[10026.548761921975,10078.28410300076,10022.436954992387,10049.837283760582,10083.172861582088],"neural_predictions":[193552,178739,177790,179661,182199],"p_positive":[0.5049473923820714,0.5042270074277743,0.5054887240449739,0.4989198625916178,0.5002586557949037],"p_positive_error":[0.004947392382071425,0.004227007427774265,0.005488724044973914,-0.001080137408382198,0.00025865579490369495],"seed":[1,2,3,4,5],"training_operations":[64,64,64,64,64]}},"note":"Two configurations of Nautilus 1.0.6 run to the same n_eff target on a 2-D toy; not a general benchmark. Counters are totals over all runs. Likelihood calls are not wall time: the networks' training and prediction cost is reported separately."},"phases":[],"provenance":{"command":"python scripts/generate_traces.py --only nautilus","generator":"samplingdemo.tracegen.nautilus","git_dirty":true,"git_sha":"cd093f41583f61e66988cd363c3cf234df442558","packages":{"nautilus-sampler":"1.0.6","numpy":"2.5.4","python":"3.13.16","scikit-learn":"1.9.1","scipy":"1.18.1"}},"rng":{"generator":"numpy.random.PCG64","seed":null,"streams":{"networks":"sklearn MLPRegressor random_state = network index 0..n_networks-1 (MT19937), fixed by nautilus 1.0.6","sampler":"numpy.random.default_rng(seed) inside nautilus.Sampler for each seed in [1, 2, 3, 4, 5]"}},"schema_version":"1.0","series":{},"title":"Nautilus n_networks 4 vs 0 on B-curved","trace_id":"nautilus/ablation-B-curved"}
